{
  "$schema": "https://json-schema.org/draft/2020-12/schema",
  "$id": "https://github.com/oooBCKooo/world-hub/docs/ecosystem/pack.schema.json",
  "title": "Optional external program composition pack, v1",
  "$comment": "Cross references, unique identities, concrete Hub topics, a cycle-free deployment DAG, exact contract bindings and effective ACLs require reference Runtime validation. These are external deployment choices, not Hub protocol requirements.",
  "type": "object",
  "additionalProperties": false,
  "required": [
    "format",
    "id",
    "version",
    "title",
    "license",
    "topics",
    "components",
    "bindings",
    "entry",
    "startupTimeoutMs",
    "healthTimeoutMs",
    "stopTimeoutMs"
  ],
  "properties": {
    "packType": {
      "description": "Failure-handling preset. Omission selects atomic; lifecyclePolicy never implies a pack type. Both honor each member's autostart selection and explicit after dependencies, and retain reviewed dynamic control.",
      "enum": ["atomic", "mesh"],
      "default": "atomic"
    },
    "lifecyclePolicy": {
      "description": "Failure policy, independently overridable for either preset. Omission uses fail-fast for atomic and independent for mesh. An attempted critical member failure always stops the run. Atomic initial startup requires every selected member to succeed; unselected members can be started later.",
      "enum": ["fail-fast", "independent"]
    },
    "startupOrder": {
      "description": "Optional exact execution order containing every installed component ID once, including manual members. Every explicit after prerequisite must precede its dependent. Runtime validates the exact set and precedence; only autostart-selected members start initially. Omission uses declaration-derived topological order.",
      "type": "array",
      "minItems": 1,
      "maxItems": 32,
      "uniqueItems": true,
      "items": { "$ref": "#/$defs/id" }
    },
    "format": {
      "const": "world-hub.pack/v1"
    },
    "id": {
      "$ref": "#/$defs/id"
    },
    "version": {
      "$ref": "#/$defs/version"
    },
    "lineage": {
      "description": "Optional author-declared source baseline and local customization identity, covered by the package content lock. This declaration does not authenticate a publisher or assert official status. pack.version remains the only deployable version.",
      "oneOf": [
        {
          "type": "object",
          "additionalProperties": false,
          "required": ["format", "kind"],
          "properties": {
            "format": { "const": "world-hub.pack-lineage/v1" },
            "kind": { "const": "self-created" }
          }
        },
        {
          "type": "object",
          "additionalProperties": false,
          "required": ["format", "kind", "base", "revision", "customizedAt"],
          "properties": {
            "format": { "const": "world-hub.pack-lineage/v1" },
            "kind": { "const": "customized" },
            "base": {
              "type": "object",
              "additionalProperties": false,
              "required": ["id", "version", "sourceDigest"],
              "properties": {
                "id": { "$ref": "#/$defs/id" },
                "version": { "$ref": "#/$defs/version" },
                "sourceDigest": {
                  "description": "SHA-256 of the source authoring revision at the first customization; not a signature or publisher identity.",
                  "type": "string",
                  "pattern": "^[a-f0-9]{64}$"
                }
              }
            },
            "revision": { "type": "integer", "minimum": 1, "maximum": 9007199254740991 },
            "customizedAt": {
              "$comment": "The Runtime additionally checks that this is a real calendar instant with exact canonical ISO formatting.",
              "type": "string",
              "format": "date-time",
              "pattern": "^\\d{4}-\\d{2}-\\d{2}T\\d{2}:\\d{2}:\\d{2}\\.\\d{3}Z$"
            }
          }
        }
      ]
    },
    "title": {
      "type": "string",
      "minLength": 1,
      "maxLength": 256,
      "pattern": "^[^\\u0000]+$"
    },
    "license": {
      "type": "string",
      "minLength": 1,
      "maxLength": 128,
      "pattern": "^[^\\u0000]+$"
    },
    "topics": {
      "type": "object",
      "minProperties": 1,
      "maxProperties": 64,
      "propertyNames": {
        "$ref": "#/$defs/id"
      },
      "additionalProperties": {
        "type": "string",
        "minLength": 1,
        "maxLength": 512,
        "pattern": "^[^\\s\\u0000#+/]+(?:/[^\\s\\u0000#+/]+)*$"
      }
    },
    "components": {
      "type": "array",
      "minItems": 1,
      "maxItems": 32,
      "items": {
        "type": "object",
        "additionalProperties": false,
        "required": [
          "id",
          "module",
          "after",
          "settings",
          "bridges"
        ],
        "properties": {
          "autostart": {
            "description": "Whether the saved startup plan requests this member, for either Atomic or Mesh. Manual members remain available for later reviewed starts and are never implicitly activated by dependents. A temporary hub-only run skips the saved plan without changing it.",
            "type": "boolean",
            "default": true
          },
          "critical": {
            "description": "A failed requested start or unexpected runtime failure stops the entire run even under independent failure policy. A planned stop or an unrequested manual member is not a failure.",
            "type": "boolean",
            "default": false
          },
          "id": {
            "$ref": "#/$defs/id"
          },
          "module": {
            "$ref": "#/$defs/id"
          },
          "after": {
            "description": "Explicit readiness prerequisites for startup. These order selected members but do not implicitly select or start prerequisites. Capability bindings and communication routes do not imply startup dependencies.",
            "type": "array",
            "maxItems": 31,
            "uniqueItems": true,
            "items": {
              "$ref": "#/$defs/id"
            }
          },
          "settings": {
            "type": "object"
          },
          "topicAliases": {
            "description": "Explicit program-local alias to pack topic key map. It grants no access; bridge ACLs remain authoritative.",
            "type": "object",
            "minProperties": 1,
            "maxProperties": 64,
            "propertyNames": { "$ref": "#/$defs/id" },
            "additionalProperties": { "$ref": "#/$defs/id" }
          },
          "bridges": {
            "type": "object",
            "minProperties": 1,
            "maxProperties": 8,
            "propertyNames": {
              "$ref": "#/$defs/id"
            },
            "additionalProperties": {
              "type": "object",
              "additionalProperties": false,
              "required": [
                "publish",
                "subscribe"
              ],
              "properties": {
                "publish": {
                  "$ref": "#/$defs/topicAliases"
                },
                "subscribe": {
                  "$ref": "#/$defs/topicAliases"
                }
              }
            }
          }
        }
      }
    },
    "bindings": {
      "type": "array",
      "maxItems": 1024,
      "uniqueItems": true,
      "items": {
        "type": "object",
        "additionalProperties": false,
        "required": [
          "from",
          "to",
          "contract"
        ],
        "properties": {
          "from": {
            "$ref": "#/$defs/id"
          },
          "to": {
            "$ref": "#/$defs/id"
          },
          "contract": {
            "type": "object",
            "additionalProperties": false,
            "required": [
              "id",
              "version"
            ],
            "properties": {
              "id": {
                "type": "string",
                "minLength": 1,
              "maxLength": 128,
              "pattern": "^[^\\u0000]+$"
              },
              "version": {
                "$ref": "#/$defs/version"
              }
            }
          }
        }
      }
    },
    "entry": {
      "type": "object",
      "additionalProperties": false,
      "required": [
        "component"
      ],
      "properties": {
        "component": {
          "$ref": "#/$defs/id"
        }
      }
    },
    "startupTimeoutMs": {
      "$ref": "#/$defs/timeout"
    },
    "healthTimeoutMs": {
      "$ref": "#/$defs/timeout"
    },
    "stopTimeoutMs": {
      "$ref": "#/$defs/timeout"
    }
  },
  "$defs": {
    "id": {
      "type": "string",
      "pattern": "^[a-z0-9][a-z0-9._-]{0,63}$"
    },
    "version": {
      "type": "string",
      "maxLength": 128,
      "pattern": "^(0|[1-9][0-9]*)\\.(0|[1-9][0-9]*)\\.(0|[1-9][0-9]*)(?:-[0-9A-Za-z]+(?:[.-][0-9A-Za-z]+)*)?$"
    },
    "topicAliases": {
      "type": "array",
      "maxItems": 64,
      "uniqueItems": true,
      "items": {
        "$ref": "#/$defs/id"
      }
    },
    "timeout": {
      "type": "integer",
      "minimum": 100,
      "maximum": 60000
    }
  }
}
